{"case_id":"demo-case-001","checks":[{"check_id":"pack_present","note":"","status":"PASS"},{"check_id":"manifest_schema","note":"","status":"PASS"},{"check_id":"manifest_canonical","note":"","status":"PASS"},{"check_id":"pack_digest","note":"","status":"PASS"},{"check_id":"member_coverage","note":"","status":"PASS"},{"check_id":"snapshot_membership","note":"","status":"PASS"},{"check_id":"member_hashes","note":"","status":"PASS"},{"check_id":"cross_references","note":"","status":"PASS"},{"check_id":"manifest_signature","note":"Signature verified against caller-supplied trusted key 'demo-signer-2026-10'","status":"PASS"}],"extra_files":[],"member_results":[{"actual_digest":"sha256:53fb02729df8ed6c6a13564095ccc2c66673d9b66724fb69e5ded041914e7582","actual_size_bytes":268,"expected_digest":"sha256:53fb02729df8ed6c6a13564095ccc2c66673d9b66724fb69e5ded041914e7582","expected_size_bytes":268,"path":"artifacts/maintenance-policy.txt","status":"MATCH"},{"actual_digest":"sha256:13f59794a5d5e6b955a633ccda5195147237d63bbccdeea4152206fd9a89c53b","actual_size_bytes":112,"expected_digest":"sha256:13f59794a5d5e6b955a633ccda5195147237d63bbccdeea4152206fd9a89c53b","expected_size_bytes":112,"path":"artifacts/sensor-export.csv","status":"MATCH"},{"actual_digest":"sha256:112035262a89f0d9d919e225e77089101ab38a33c2aee71688f533612a208dc7","actual_size_bytes":541,"expected_digest":"sha256:112035262a89f0d9d919e225e77089101ab38a33c2aee71688f533612a208dc7","expected_size_bytes":541,"path":"case.json","status":"MATCH"},{"actual_digest":"sha256:3782745ccf73e7840875b9d8dbd02826ab766e5c17f440d71497dc0a7e3d66dd","actual_size_bytes":792,"expected_digest":"sha256:3782745ccf73e7840875b9d8dbd02826ab766e5c17f440d71497dc0a7e3d66dd","expected_size_bytes":792,"path":"facts.json","status":"MATCH"},{"actual_digest":"sha256:402d0e9a7fd259c30b4179fc65474af1af06ca6ddc7794884eb3939d96efdf15","actual_size_bytes":350,"expected_digest":"sha256:402d0e9a7fd259c30b4179fc65474af1af06ca6ddc7794884eb3939d96efdf15","expected_size_bytes":350,"path":"findings.json","status":"MATCH"},{"actual_digest":"sha256:b9e4d22e0ce64b7b3f88a87ebb6992cea66586ab06dc75be8adb553e65096626","actual_size_bytes":777,"expected_digest":"sha256:b9e4d22e0ce64b7b3f88a87ebb6992cea66586ab06dc75be8adb553e65096626","expected_size_bytes":777,"path":"review_actions.json","status":"MATCH"},{"actual_digest":"sha256:a52f91164b7362bf7df0b7a8de9c4ab0e111900a3c180925b245ee503dcd91c7","actual_size_bytes":2317,"expected_digest":"sha256:a52f91164b7362bf7df0b7a8de9c4ab0e111900a3c180925b245ee503dcd91c7","expected_size_bytes":2317,"path":"rule_runs.json","status":"MATCH"},{"actual_digest":"sha256:85d4674d5ca39afd6b38e0cb2e03c396e0b97f790e309594f885b74b3ff217a5","actual_size_bytes":745,"expected_digest":"sha256:85d4674d5ca39afd6b38e0cb2e03c396e0b97f790e309594f885b74b3ff217a5","expected_size_bytes":745,"path":"snapshot_context.json","status":"MATCH"},{"actual_digest":"sha256:1256ff1a052fe1bcac2afaf874550b7f852fcd12da3540f9e74091f8d07e2e67","actual_size_bytes":1832,"expected_digest":"sha256:1256ff1a052fe1bcac2afaf874550b7f852fcd12da3540f9e74091f8d07e2e67","expected_size_bytes":1832,"path":"timeline.json","status":"MATCH"}],"overall":"PACK_VALID","pack_digest":"sha256:7871579fa558987434a14932150c6b36b29c9966b7ef79d4dcf92bfa93c7f9dd","pack_digest_valid":true,"pack_id":"pack-demo-case-001","protocol_version":"oev-pack-receipt/0.1","receipt_digest":"sha256:8237ff17f55877efa7abbb3eb04c590fc6e94a4fe3fdac9f3bf3fc57bfeb6956","receipt_id":"00000000-0000-4000-8000-000000000010","recomputed_pack_digest":"sha256:7871579fa558987434a14932150c6b36b29c9966b7ef79d4dcf92bfa93c7f9dd","signature_state":"SIGNATURE_VALID","structure_errors":[],"verified_at":"2026-10-01T12:00:00Z","verifier":{"software":"oev","version":"0.2.0"}}